{
  "schema": "sns.pr-lifecycle.v1",
  "pr_number": 54,
  "quest_id": "QST-ARCI-0001",
  "acceptance_slice": "Produce one reproducible QST-ARCI-0001 synthetic-target assessment using the accepted ARCI v0.1 model: attach explicit evidence types and missing-data flags, keep score and confidence separate, run bounded weight and confidence sensitivity, and identify the next measurement without unsupported dollar valuation or queue/belief changes.",
  "state": "merged",
  "owner_run_id": "RUN-20260826T191200000000Z-daily-research-operator-7c1e4a92b6d8053f102a",
  "source_commit": "0a67b00e36606554bb8a42a81bdcc57a45e033c4",
  "head_commit": "f02d5755d6e339e3e41c41c8692d3f4dbac5d1c1",
  "updated_at": "2026-08-26T19:20:00Z",
  "next_review_after": "2026-08-27T16:26:59Z",
  "supersedes": [],
  "reason": "PR #54 squash-merged at a373dfbbf9f33059c4c44bb4102ad71b2a180682 from exact green head f02d5755d6e339e3e41c41c8692d3f4dbac5d1c1 after tests 33004219675, baseline artifacts 33004219688, automation transaction 33004219777, semantic validation, and resolution of all three review threads."
}
