{
  "schema": "sns.pr-lifecycle.v1",
  "pr_number": 87,
  "quest_id": "QST-SYNTH-0001",
  "acceptance_slice": "QST-SYNTH-0001 R1 minimal record-to-scenario adapter and development-only fixture qualification",
  "state": "merged",
  "owner_run_id": "RUN-20260909T185951000000Z-daily-research-operator-420e5ded0583870737f8",
  "source_commit": "10826785a264cee3f56295c18b6c9d85e57f59e3",
  "head_commit": "0db4ee34b0ad430bfc0535d2cb06cd32fb60b1e3",
  "updated_at": "2026-09-09T19:23:00+00:00",
  "next_review_after": "2026-09-20T21:18:43+00:00",
  "supersedes": [],
  "reason": "PR #87 was squash-merged as 0db4ee34b0ad430bfc0535d2cb06cd32fb60b1e3 after final head 139e6866366cd419f422649bb7cd308f3ce93e0f passed tests 34394350773, baseline-artifacts 34394350877, and automation-transaction 34394350784, including semantic repository validation and full pytest. Fifteen focused adapter/protocol tests and 196 full tests passed locally. In-run exact-head semantic review found no substantive defect; no independent approval is claimed. R1 generated zero worlds and made no policy-benefit claim."
}
