{
  "schema": "sns.pr-lifecycle.v1",
  "pr_number": 26,
  "quest_id": "",
  "acceptance_slice": "Issue #24 autonomous-loop transaction layer",
  "state": "merged",
  "owner_run_id": "RUN-20260715T030611654321Z-monthly-governance-e3066d8f803ef32ec01f",
  "source_commit": "b7f924a122a8282a3766cbbf8d6bcb8a8bfdef33",
  "head_commit": "583032475c2fa5b2ecdbcf74a1b6b0ac4e9937a4",
  "updated_at": "2026-07-15T03:06:11Z",
  "next_review_after": "2026-07-15T03:06:11Z",
  "supersedes": [20],
  "reason": "Merged into main as commit 25abdba204fd6394b42d1474b2bb89e5f4f98ca9 after all required test, baseline, transaction, semantic-validation, ownership, and mergeability gates passed."
}
