{
  "schema": "sns.pr-lifecycle.v1",
  "pr_number": 63,
  "quest_id": "QST-SIM-0003",
  "acceptance_slice": "Compare exactly two declared synthetic role mixes under one identical deterministic GEO-ring fixture using the accepted receiver-visibility primitive: an all-independent baseline and one fixed coordinated mix with a declared 20% storage-node fraction.",
  "state": "merged",
  "owner_run_id": "RUN-20260831T191708809243Z-daily-research-operator-9b8acc613b9b9560f003",
  "source_commit": "88ea908c6beb84d0154afb38edab13ceb9ec435d",
  "head_commit": "48503b85e1a6ab7f9b272511bead31db471b51de",
  "updated_at": "2026-08-31T19:26:36Z",
  "next_review_after": "2026-08-31T19:26:36Z",
  "supersedes": [],
  "reason": "PR #63 merged from exact head 48503b85e1a6ab7f9b272511bead31db471b51de as squash commit 96da258a356af7ec640aafe5e4ea779a93c2cb0a after tests run 33430397973, baseline-artifacts run 33430397916, and automation-transaction run 33430397902 all passed. The transaction explicitly passed 54 automation tests, semantic repository validation, and full pytest. The receipt review finding was answered and resolved. The result remains one bounded synthetic fixture observation with no architecture, belief, or quest-state mutation."
}
