{
  "schema": "sns.pr-lifecycle.v1",
  "pr_number": 23,
  "quest_id": "",
  "acceptance_slice": "2026-07-12 weekly evidence synthesis",
  "state": "draft_active",
  "owner_run_id": "RUN-20260715T025557598419Z-monthly-governance-00c6d834a923ef8c40f5",
  "source_commit": "e8afc90f6c72d0a63f68ba7519f05b0f4bc77ea6",
  "head_commit": "53b700aa35f647a1c37fffdc00ae784ab2771458",
  "updated_at": "2026-07-15T02:55:57Z",
  "next_review_after": "2026-07-16T14:00:00Z",
  "supersedes": [],
  "reason": "Evidence proposal remains reviewable and does not enact monthly queue governance."
}
