{
  "schema": "sns.pr-lifecycle.v1",
  "pr_number": 128,
  "quest_id": "QST-SIM-0003",
  "acceptance_slice": "Instrument delivered host energy by agent role and receiver-visible sunlit/eclipse state with accounting identities",
  "state": "merged",
  "owner_run_id": "RUN-20261020T165211000000Z-daily-governance-triage-432d12465407f334fa1c",
  "source_commit": "c768e21c4f064a5a823f75944ce92dbe998baea5",
  "head_commit": "c768e21c4f064a5a823f75944ce92dbe998baea5",
  "updated_at": "2026-10-20T16:52:11+00:00",
  "next_review_after": "2026-10-25T15:00:00+00:00",
  "supersedes": [],
  "reason": "PR #128 final head ce922951067a496b2e88a0bba6110e38084df9e2 passed tests run 39309023381, baseline-artifacts run 39309023378, and automation-transaction run 39309023435; exact-head Codex review completed with no findings and no unresolved review thread. It then squash-merged as c768e21c4f064a5a823f75944ce92dbe998baea5. This mechanical reconciliation changes lifecycle metadata only and preserves the accepted zero-world SIM3 instrumentation result and Weekly appraisal boundary."
}
